{
  "$schema": "../schema/institutions-source.schema.json",
  "schemaVersion": "1.0.0",
  "country": "TR",
  "ibanFormat": {
    "length": 26,
    "providerCodeLength": 5,
    "reserveLength": 1,
    "accountLength": 16
  },
  "dataVersion": "2026-07-31",
  "sourcePolicy": "Official-source-first with explicit evidence scope and human review.",
  "sources": [
    {
      "id": "tcmb-active-electronic-money-institutions",
      "publisher": "Türkiye Cumhuriyet Merkez Bankası",
      "title": "Aktif Elektronik Para Kuruluşları",
      "url": "https://www.tcmb.gov.tr/wps/wcm/connect/tr/tcmb%2Btr/main%2Bmenu/temel%2Bfaaliyetler/odeme%2Bhizmetleri/elektronik%2Bpara%2Bkuruluslari",
      "classification": "official",
      "usage": "monitor_only",
      "evidenceScope": [
        "institution_type",
        "institution_status"
      ],
      "retrievedAt": "2026-07-31",
      "sha256": "af102df0406957f17d0c2a9c2d1bab90a4de718ec346e99d07b64bb85ea167a0",
      "extractionMethod": "HTML content hash monitoring; no record enrichment in this snapshot",
      "redistributionStatus": "No source content is redistributed; only source metadata and its SHA-256 hash are published."
    },
    {
      "id": "tcmb-active-payment-institutions",
      "publisher": "Türkiye Cumhuriyet Merkez Bankası",
      "title": "Aktif Ödeme Kuruluşları",
      "url": "https://www.tcmb.gov.tr/wps/wcm/connect/tr/tcmb%2Btr/main%2Bmenu/temel%2Bfaaliyetler/odeme%2Bhizmetleri/odeme%2Bkuruluslari",
      "classification": "official",
      "usage": "monitor_only",
      "evidenceScope": [
        "institution_type",
        "institution_status"
      ],
      "retrievedAt": "2026-07-31",
      "sha256": "cdba0f3ec40b984fb778344e88ab2f716f9deb5da23b31edc20dc7d9b69eed66",
      "extractionMethod": "HTML content hash monitoring; no record enrichment in this snapshot",
      "redistributionStatus": "No source content is redistributed; only source metadata and its SHA-256 hash are published."
    },
    {
      "id": "tcmb-payment-systems-participants-2025",
      "publisher": "Türkiye Cumhuriyet Merkez Bankası",
      "title": "TCMB Ödeme Sistemleri Katılımcıları (2025)",
      "url": "https://www.tcmb.gov.tr/wps/wcm/connect/9fa62a85-5b6d-46c5-9b01-eb461d43723d/TCMB%2B%C3%96deme%2BSistemleri%2BKat%C4%B1l%C4%B1mc%C4%B1lar%C4%B1%2B%282025%29.pdf?MOD=AJPERES",
      "classification": "official",
      "usage": "primary_code_evidence",
      "evidenceScope": [
        "provider_code"
      ],
      "retrievedAt": "2026-07-31",
      "sha256": "55685b26c05f051983a310e475b24c1beeed9f22d712c1bfa66508f6b41204b2",
      "extractionMethod": "PDF text table extraction followed by maintainer review",
      "redistributionStatus": "Extracted factual fields are redistributed; the source PDF is not bundled."
    }
  ],
  "institutions": [
    {
      "code": "00001",
      "rawCode": "0001",
      "nameOfficial": "T.C. MERKEZ BANKASI",
      "nameShort": "T.C. MERKEZ BANKASI",
      "type": "central_bank",
      "status": "unknown",
      "systems": [
        "TCMB_PAYMENT_SYSTEMS"
      ],
      "codeEvidence": [
        "payment_system_participant"
      ],
      "aliases": [],
      "sourceIds": [
        "tcmb-payment-systems-participants-2025"
      ],
      "lastVerifiedAt": "2026-07-31"
    },
    {
      "code": "00004",
      "rawCode": "0004",
      "nameOfficial": "İLLER BANKASI A.Ş.",
      "nameShort": "İLLER BANKASI",
      "type": "bank",
      "status": "unknown",
      "systems": [
        "TCMB_PAYMENT_SYSTEMS"
      ],
      "codeEvidence": [
        "payment_system_participant"
      ],
      "aliases": [],
      "sourceIds": [
        "tcmb-payment-systems-participants-2025"
      ],
      "lastVerifiedAt": "2026-07-31"
    },
    {
      "code": "00010",
      "rawCode": "0010",
      "nameOfficial": "T.C. ZİRAAT BANKASI A.Ş.",
      "nameShort": "T.C. ZİRAAT BANKASI",
      "type": "bank",
      "status": "unknown",
      "systems": [
        "TCMB_PAYMENT_SYSTEMS"
      ],
      "codeEvidence": [
        "payment_system_participant"
      ],
      "aliases": [],
      "sourceIds": [
        "tcmb-payment-systems-participants-2025"
      ],
      "lastVerifiedAt": "2026-07-31"
    },
    {
      "code": "00012",
      "rawCode": "0012",
      "nameOfficial": "T. HALK BANKASI A.Ş.",
      "nameShort": "T. HALK BANKASI",
      "type": "bank",
      "status": "unknown",
      "systems": [
        "TCMB_PAYMENT_SYSTEMS"
      ],
      "codeEvidence": [
        "payment_system_participant"
      ],
      "aliases": [],
      "sourceIds": [
        "tcmb-payment-systems-participants-2025"
      ],
      "lastVerifiedAt": "2026-07-31"
    },
    {
      "code": "00014",
      "rawCode": "0014",
      "nameOfficial": "T. SINAİ KALKINMA BANKASI A.Ş.",
      "nameShort": "T. SINAİ KALKINMA BANKASI",
      "type": "bank",
      "status": "unknown",
      "systems": [
        "TCMB_PAYMENT_SYSTEMS"
      ],
      "codeEvidence": [
        "payment_system_participant"
      ],
      "aliases": [],
      "sourceIds": [
        "tcmb-payment-systems-participants-2025"
      ],
      "lastVerifiedAt": "2026-07-31"
    },
    {
      "code": "00015",
      "rawCode": "0015",
      "nameOfficial": "T. VAKIFLAR BANKASI T.A.O.",
      "nameShort": "T. VAKIFLAR BANKASI",
      "type": "bank",
      "status": "unknown",
      "systems": [
        "TCMB_PAYMENT_SYSTEMS"
      ],
      "codeEvidence": [
        "payment_system_participant"
      ],
      "aliases": [],
      "sourceIds": [
        "tcmb-payment-systems-participants-2025"
      ],
      "lastVerifiedAt": "2026-07-31"
    },
    {
      "code": "00016",
      "rawCode": "0016",
      "nameOfficial": "T. EXİMBANK",
      "nameShort": "T. EXİMBANK",
      "type": "bank",
      "status": "unknown",
      "systems": [
        "TCMB_PAYMENT_SYSTEMS"
      ],
      "codeEvidence": [
        "payment_system_participant"
      ],
      "aliases": [],
      "sourceIds": [
        "tcmb-payment-systems-participants-2025"
      ],
      "lastVerifiedAt": "2026-07-31"
    },
    {
      "code": "00017",
      "rawCode": "0017",
      "nameOfficial": "T. KALKINMA BANKASI A.Ş.",
      "nameShort": "T. KALKINMA BANKASI",
      "type": "bank",
      "status": "unknown",
      "systems": [
        "TCMB_PAYMENT_SYSTEMS"
      ],
      "codeEvidence": [
        "payment_system_participant"
      ],
      "aliases": [],
      "sourceIds": [
        "tcmb-payment-systems-participants-2025"
      ],
      "lastVerifiedAt": "2026-07-31"
    },
    {
      "code": "00029",
      "rawCode": "0029",
      "nameOfficial": "BİRLEŞİK FON BANKASI A.Ş.",
      "nameShort": "BİRLEŞİK FON BANKASI",
      "type": "bank",
      "status": "unknown",
      "systems": [
        "TCMB_PAYMENT_SYSTEMS"
      ],
      "codeEvidence": [
        "payment_system_participant"
      ],
      "aliases": [],
      "sourceIds": [
        "tcmb-payment-systems-participants-2025"
      ],
      "lastVerifiedAt": "2026-07-31"
    },
    {
      "code": "00032",
      "rawCode": "0032",
      "nameOfficial": "T. EKONOMİ BANKASI A.Ş.",
      "nameShort": "T. EKONOMİ BANKASI",
      "type": "bank",
      "status": "unknown",
      "systems": [
        "TCMB_PAYMENT_SYSTEMS"
      ],
      "codeEvidence": [
        "payment_system_participant"
      ],
      "aliases": [],
      "sourceIds": [
        "tcmb-payment-systems-participants-2025"
      ],
      "lastVerifiedAt": "2026-07-31"
    },
    {
      "code": "00046",
      "rawCode": "0046",
      "nameOfficial": "AKBANK T.A.Ş.",
      "nameShort": "AKBANK",
      "type": "bank",
      "status": "unknown",
      "systems": [
        "TCMB_PAYMENT_SYSTEMS"
      ],
      "codeEvidence": [
        "payment_system_participant"
      ],
      "aliases": [],
      "sourceIds": [
        "tcmb-payment-systems-participants-2025"
      ],
      "lastVerifiedAt": "2026-07-31"
    },
    {
      "code": "00059",
      "rawCode": "0059",
      "nameOfficial": "ŞEKERBANK T.A.Ş.",
      "nameShort": "ŞEKERBANK",
      "type": "bank",
      "status": "unknown",
      "systems": [
        "TCMB_PAYMENT_SYSTEMS"
      ],
      "codeEvidence": [
        "payment_system_participant"
      ],
      "aliases": [],
      "sourceIds": [
        "tcmb-payment-systems-participants-2025"
      ],
      "lastVerifiedAt": "2026-07-31"
    },
    {
      "code": "00060",
      "rawCode": "0060",
      "nameOfficial": "TÜRK TİCARET BANKASI A.Ş.",
      "nameShort": "TÜRK TİCARET BANKASI",
      "type": "bank",
      "status": "unknown",
      "systems": [
        "TCMB_PAYMENT_SYSTEMS"
      ],
      "codeEvidence": [
        "payment_system_participant"
      ],
      "aliases": [],
      "sourceIds": [
        "tcmb-payment-systems-participants-2025"
      ],
      "lastVerifiedAt": "2026-07-31"
    },
    {
      "code": "00062",
      "rawCode": "0062",
      "nameOfficial": "T. GARANTİ BANKASI A.Ş.",
      "nameShort": "T. GARANTİ BANKASI",
      "type": "bank",
      "status": "unknown",
      "systems": [
        "TCMB_PAYMENT_SYSTEMS"
      ],
      "codeEvidence": [
        "payment_system_participant"
      ],
      "aliases": [],
      "sourceIds": [
        "tcmb-payment-systems-participants-2025"
      ],
      "lastVerifiedAt": "2026-07-31"
    },
    {
      "code": "00064",
      "rawCode": "0064",
      "nameOfficial": "T. İŞ BANKASI A.Ş.",
      "nameShort": "T. İŞ BANKASI",
      "type": "bank",
      "status": "unknown",
      "systems": [
        "TCMB_PAYMENT_SYSTEMS"
      ],
      "codeEvidence": [
        "payment_system_participant"
      ],
      "aliases": [],
      "sourceIds": [
        "tcmb-payment-systems-participants-2025"
      ],
      "lastVerifiedAt": "2026-07-31"
    },
    {
      "code": "00067",
      "rawCode": "0067",
      "nameOfficial": "YAPI VE KREDİ BANKASI A.Ş.",
      "nameShort": "YAPI VE KREDİ BANKASI",
      "type": "bank",
      "status": "unknown",
      "systems": [